{
  "kinematics": {
    "bodies": [
      "base",
      "saddle",
      "table",
      "spindle"
    ],
    "chain": [
      "x",
      "y",
      "z"
    ],
    "frames": [
      {
        "name": "machine",
        "origin": [
          0.0,
          0.0,
          0.0
        ],
        "xAxis": [
          1.0,
          0.0,
          0.0
        ],
        "yAxis": [
          0.0,
          1.0,
          0.0
        ],
        "zAxis": [
          0.0,
          0.0,
          1.0
        ]
      }
    ],
    "joints": [
      {
        "axisDirection": [
          1.0,
          0.0,
          0.0
        ],
        "axisOrigin": [
          0.0,
          0.0,
          0.0
        ],
        "childBody": "saddle",
        "id": "x",
        "limits": {
          "max": 800.0,
          "min": 0.0
        },
        "parentBody": "base",
        "type": "prismatic"
      },
      {
        "axisDirection": [
          0.0,
          1.0,
          0.0
        ],
        "axisOrigin": [
          0.0,
          0.0,
          0.0
        ],
        "childBody": "table",
        "id": "y",
        "limits": {
          "max": 600.0,
          "min": 0.0
        },
        "parentBody": "saddle",
        "type": "prismatic"
      },
      {
        "axisDirection": [
          0.0,
          0.0,
          1.0
        ],
        "axisOrigin": [
          0.0,
          0.0,
          0.0
        ],
        "childBody": "spindle",
        "id": "z",
        "limits": {
          "max": 500.0,
          "min": 0.0
        },
        "parentBody": "table",
        "type": "prismatic"
      }
    ],
    "pkmVersion": "0.2"
  },
  "machineId": "fanuc-3x-vmc",
  "machineName": "fanuc-3x-vmc",
  "metadata": {},
  "schemaVersion": "1.0",
  "source": {
    "inputPath": "/mnt/c/dev/praxis-cadcam/engine/tests/fixtures/artifact/sample-pkm.json",
    "inputType": "pkm",
    "pkmVersion": "0.2"
  },
  "units": "mm"
}
